Question,Answer
"What is mental health?","Mental health includes our emotional, psychological, and social well-being. It affects how we think, feel, and act. It also helps determine how we handle stress, relate to others, and make choices."
"What are common mental health disorders?","Common mental health disorders include anxiety disorders, depression, bipolar disorder, schizophrenia, and eating disorders."
"What are the symptoms of depression?","Symptoms of depression can include persistent sadness, loss of interest in activities, changes in appetite, difficulty sleeping or sleeping too much, loss of energy, and thoughts of death or suicide."
"How can I help someone with a mental health issue?","Listen without judgment, encourage them to seek professional help, support them in finding resources, and offer to accompany them to appointments."
"What are the treatments for anxiety?","Treatments for anxiety can include psychotherapy (such as cognitive-behavioral therapy), medications (such as antidepressants or anxiolytics), lifestyle changes, and relaxation techniques."
"What should I do if I am feeling overwhelmed?","If you are feeling overwhelmed, it can help to talk to someone you trust, practice relaxation techniques, prioritize tasks, and seek professional help if needed."
"What is cognitive-behavioral therapy (CBT)?","CBT is a type of psychotherapy that helps people identify and change negative thought patterns and behaviors. It is commonly used to treat a variety of mental health conditions, including anxiety and depression."
"How can I manage stress?","Stress can be managed through regular physical activity, relaxation techniques (such as deep breathing or meditation), time management, healthy eating, and seeking support from friends, family, or a professional."
"What are the warning signs of a mental health crisis?","Warning signs of a mental health crisis can include severe mood swings, withdrawal from friends and activities, significant changes in behavior or personality, and thoughts of self-harm or suicide."
"Where can I find mental health resources?","Mental health resources can be found through healthcare providers, mental health organizations, helplines, online platforms, and community centers."
